{
  "posture_version": "0.1",
  "identity": {
    "snapshot_id": "posture-bscode-demo-001",
    "agent_id": "bscode-agent-demo-001",
    "captured_at": "2026-06-28T00:00:00Z"
  },
  "servers": [
    {
      "server_id": "cloudflare-docs",
      "server_name": "Cloudflare Docs MCP",
      "version": "1.0.0",
      "provenance": "verified",
      "tools": [
        {
          "tool_id": "search-cf-docs",
          "tool_name": "search_cloudflare_documentation",
          "permissions": ["network:outbound"],
          "risk_categories": ["ssrf"],
          "risk_severity": "low"
        }
      ]
    },
    {
      "server_id": "github-actions",
      "server_name": "GitHub Actions MCP",
      "version": "2.1.3",
      "provenance": "unverified",
      "tools": [
        {
          "tool_id": "run-workflow",
          "tool_name": "run_workflow_dispatch",
          "permissions": ["network:outbound", "workflow:trigger"],
          "risk_categories": ["command_execution", "privilege_escalation"],
          "risk_severity": "high"
        },
        {
          "tool_id": "create-issue",
          "tool_name": "create_repository_issue",
          "permissions": ["network:outbound"],
          "risk_categories": ["exfiltration"],
          "risk_severity": "medium"
        }
      ]
    }
  ],
  "permission_graph": {
    "total_tools": 3,
    "total_permissions": 4,
    "high_risk_tools": 1,
    "permission_scopes": ["network:outbound", "workflow:trigger"]
  },
  "risk_summary": [
    {
      "finding_id": "finding-001",
      "severity": "low",
      "category": "ssrf",
      "description": "search_cloudflare_documentation makes outbound HTTP requests. Scope is limited to docs.cloudflare.com.",
      "tool_id": "search-cf-docs",
      "owasp_mcp_ref": "MCP-02"
    },
    {
      "finding_id": "finding-002",
      "severity": "high",
      "category": "command_execution",
      "description": "run_workflow_dispatch can trigger arbitrary GitHub Actions workflows, which may execute untrusted code in the CI environment.",
      "tool_id": "run-workflow",
      "owasp_mcp_ref": "MCP-04"
    },
    {
      "finding_id": "finding-003",
      "severity": "medium",
      "category": "exfiltration",
      "description": "create_repository_issue can write arbitrary content to public repositories, potentially leaking sensitive data.",
      "tool_id": "create-issue",
      "owasp_mcp_ref": "MCP-01"
    }
  ],
  "drift": {},
  "attestation": {
    "generator": "agent-trust-infra/examples"
  }
}
